{
  "$schema": "https://json-schema.org/draft/2020-12/schema",
  "$id": "https://viewcompose.com/schemas/ai/ai-tooling-release-v2.schema.json",
  "title": "ViewCompose AI tooling npm and GitHub Release contract v2",
  "type": "object",
  "additionalProperties": false,
  "required": ["schemaVersion", "releaseId", "repository", "workflowPath", "package", "assets", "npm", "provenance", "installation"],
  "properties": {
    "schemaVersion": {"const": 2},
    "releaseId": {"const": "viewcompose-ai-tooling-npm-github-release-v2"},
    "repository": {"const": "ViewCompose/ViewCompose"},
    "workflowPath": {"const": ".github/workflows/ai-tooling-release.yml"},
    "package": {
      "type": "object",
      "additionalProperties": false,
      "required": ["name", "version", "tag", "tagPattern", "immutable"],
      "properties": {
        "name": {"const": "@viewcompose/ai-tooling"},
        "version": {"const": "0.8.0"},
        "tag": {"const": "ai-tooling-v0.8.0"},
        "tagPattern": {"const": "ai-tooling-v<semver>"},
        "immutable": {"const": true}
      }
    },
    "assets": {
      "type": "array",
      "prefixItems": [
        {"const": "viewcompose-ai-tooling-0.8.0.tgz"},
        {"const": "manifest.json"},
        {"const": "SHA256SUMS"}
      ],
      "items": false,
      "minItems": 3,
      "maxItems": 3,
      "uniqueItems": true
    },
    "npm": {
      "type": "object",
      "additionalProperties": false,
      "required": ["registry", "access", "trustedPublishing", "minimumCli", "provenance", "installScripts"],
      "properties": {
        "registry": {"const": "https://registry.npmjs.org"},
        "access": {"const": "public"},
        "trustedPublishing": {"const": "github-actions-oidc"},
        "minimumCli": {"const": "11.5.1"},
        "provenance": {"const": true},
        "installScripts": {"const": false}
      }
    },
    "provenance": {
      "type": "object",
      "additionalProperties": false,
      "required": ["provider", "attestationRequired", "checksumAlgorithm"],
      "properties": {
        "provider": {"const": "github-artifact-attestations"},
        "attestationRequired": {"const": true},
        "checksumAlgorithm": {"const": "SHA-256"}
      }
    },
    "installation": {
      "type": "object",
      "additionalProperties": false,
      "required": [
        "source",
        "buildFromSourceRequired",
        "sourceCheckoutRequiredForStandalone",
        "manualConfigurationEdits",
        "maxPrimaryCommands",
        "pinnedVersionRequired"
      ],
      "properties": {
        "source": {"const": "exact-version-npm"},
        "buildFromSourceRequired": {"const": false},
        "sourceCheckoutRequiredForStandalone": {"const": false},
        "manualConfigurationEdits": {"const": 0},
        "maxPrimaryCommands": {"const": 1},
        "pinnedVersionRequired": {"const": true}
      }
    }
  }
}
